<?xml version="1.0" encoding="cp950" ?>
<?xml-stylesheet type="text/xsl" href="../dtd/cbeta.xsl" ?>
<!DOCTYPE TEI.2 SYSTEM "../dtd/cbetaxml.dtd"
[<!ENTITY % ENTY SYSTEM "T15n0605.ent">
<!ENTITY % CBENT SYSTEM "../dtd/cbeta.ent">
%ENTY;
%CBENT;
]>
<TEI.2>
<teiHeader>
	<fileDesc>
		<titleStmt>
			<title>Taisho Tripitaka, Electronic version, No. 0605 禪行法想經</title>
			<author>後漢 安世高譯</author>
			<respStmt>
				<resp>Electronic Version by</resp>
				<name>CBETA</name>
			</respStmt>
		</titleStmt>
	<editionStmt>
		<edition>$Revision: 1.11 $ (Big5)<date>$Date: 2012/08/27 03:14:58 $</date>新式標點版</edition>
	</editionStmt>
	<extent>1卷</extent>
	<publicationStmt>
		<distributor>
			<name>中華電子佛典協會 (CBETA)</name>
			<address>
				<addrLine>service@cbeta.org</addrLine>
			</address>
		</distributor>
		<availability>
			<p>Available for non-commercial use when distributed with this header intact.</p>
		</availability>
		<date>$Date: 2012/08/27 03:14:58 $</date>
	</publicationStmt>
	<sourceDesc>
		<bibl>Taisho Tripitaka Vol. 15, No. 605 &desc;</bibl>
	</sourceDesc>
</fileDesc>
<encodingDesc>
	<projectDesc>
		<p lang="eng" type="ly">Text as provided by Mr. Hsiao Chen-Kuo, Text as provided by Mr. Christian Wittern, Text as provided by SAT, Japan, Text as provided by Anonymous, USA, Punctuated text as provided by Mr. Ji Ge Ai Nuo</p>
		<p lang="chi" type="ly">蕭鎮國大德提供，維習安大德提供，日本 SAT 組織提供，北美某大德提供，吉格艾諾提供新式標點</p>
	</projectDesc>
</encodingDesc>
<profileDesc>
		<langUsage>
			<language id="eng">English</language>
			<language id="chi">Chinese</language>
		</langUsage>
	</profileDesc>
	<revisionDesc>
	<change>
		<date>19991011/23:56:07</date>
		<respStmt><name>CW</name><resp>ed.</resp></respStmt>
		<item>Created initial TEI XML version with BASICX.BAT (99/10/12)</item>
	</change>
<!--
$Log: T15n0605.xml,v $
Revision 1.11  2012/08/27 03:14:58  maha
修訂新標小圓點及著重號

Revision 1.10  2011/09/15 05:46:53  eva
上傳 新式標點版

Revision 1.9  2009/04/23 07:58:51  amtbgrace
modified: 檔頭編碼由 big5 改為 cp950。

Revision 1.8  2006/04/12 21:54:56  saywhat
lem 加 wit 屬性，p, lg, item 第二次加 id 屬性

Revision 1.6  2004/10/11 23:56:36  saywhat
段落前加入圈點

Revision 1.5  2004/09/13 14:17:03  saywhat
<trailer> => <juan fun="close"><jhead>

Revision 1.4  2004/04/20 08:38:10  maha
「版本日期」標記修訂

Revision 1.3  2003/06/19 03:44:38  eva
modified: 插入星號校勘

Revision 1.2  2003/05/05 06:23:10  eva
modified

Revision 1.16  2002/12/05 12:30:40  eva
modified

Revision 1.15  2002/11/04 10:41:11  ray
tei.2 => TEI.2

Revision 1.14  2002/10/07 13:07:34  moved
modified

Revision 1.13  2002/07/29 09:54:42  vinking
modified lang

Revision 1.12  2002/04/04 07:44:15  ray
xml:stylesheet => xml-stylesheet

Revision 1.11  2001/07/27 07:11:29  ray
去除多餘的 <author>

Revision 1.10  2001/07/24 06:51:17  ray
add 作者、譯者 <author> 卷數 <extent>

Revision 1.9  2001/05/25 08:56:15  ray
經號統一為四碼

Revision 1.8  2001/03/30 05:43:38  ray
缺字CB碼由四碼增長為五碼

Revision 1.7  2001/03/25 09:03:43  ray
add <milestone>

Revision 1.6  2001/02/07 06:50:19  chris
Fixed problem with comment in the previous checkin

Revision 1.5  2001/02/03 07:39:48  chris
Added keywords $Revision: 1.11 $, $Date: 2012/08/27 03:14:58 $ and $Log.
Added comment  for Emacs

-->
 </revisionDesc>
</teiHeader>
<text><body>
<lb n="0181b14" ed="T"/>
<milestone n="1" unit="juan"/>
<lb n="0181b15" ed="T"/>
<lb n="0181b16" ed="T"/><head type="no">No. 605</head>
<lb n="0181b17" ed="T"/><juan n="001" fun="open"><mulu n="001" type="卷"/><jhead><title>禪行法想經</title></jhead></juan>
<lb n="0181b18" ed="T"/>
<lb n="0181b19" ed="T"/><byline type="Translator">後漢<note n="0181008" resp="Taisho" type="orig" place="foot text">〔安息國〕－【宋】【元】【宮】</note><app n="0181008"><lem wit="【大】">安息國</lem><rdg resp="Taisho" wit="【宋】【元】【宮】">&lac;</rdg></app>三藏安世高譯</byline>
<lb n="0181b20" ed="T"/><div1 type="jing"><p id="pT15p0181b2001">聞如是：</p><p id="pT15p0181b2004" place="inline">一時，佛遊於<note n="0181009" resp="Taisho" type="orig" place="foot text">舍衛＋（國）【三】</note><note n="0181009" resp="CBETA" type="mod">舍衛＋（國）【宋】【元】【明】</note><app n="0181009"><lem wit="【大】">舍衛</lem><rdg resp="Taisho" wit="【宋】【元】【明】">舍衛國</rdg></app>祇樹給孤獨園。佛
<lb n="0181b21" ed="T"/>告：「諸比丘！」比丘受教，從佛而聽。</p><p id="pT15p0181b2113" place="inline">佛言：「諸比丘！
<lb n="0181b22" ed="T"/>若以彈指間，思惟死想，念有身皆死，是為精
<lb n="0181b23" ed="T"/>進行禪，為如佛教，不是愚癡食國人施也，何
<lb n="0181b24" ed="T"/>況多行者！取要言之，若念不淨想、穢食想、一
<lb n="0181b25" ed="T"/>切世間無有樂想、無常想、無常為<note n="0181010" resp="Taisho" type="orig" place="foot text">苦＝若【明】＊</note><app n="0181010"><lem wit="【大】">苦</lem><rdg resp="Taisho" wit="【明】">若</rdg></app>想、<app type="＊" source="0181010"><lem wit="【大】">苦</lem><rdg resp="Taisho" wit="【明】">若</rdg></app>
<lb n="0181b26" ed="T"/>為非身想、非身為空想、棄離想、&CB00230;婬想、滅盡
<lb n="0181b27" ed="T"/>想、無我想；身死為蟲食想、血流想、&CB00167;脹想、
<lb n="0181b28" ed="T"/>青腐想、糜爛腥臭想、髮落肉盡想、一切縛解
<lb n="0181b29" ed="T"/>想、骨節分散想、骨變赤白枯黑亦如鳩色想、
<pb n="0181c" ed="T" id="T15.0605.0181c"/>
<lb n="0181c01" ed="T"/>骨糜為灰想、世間無所歸想、世間無牢固想、
<lb n="0181c02" ed="T"/>世間為別離想、世間闇冥想、世間難忍想、世
<lb n="0181c03" ed="T"/>為費耗不中用想、世為災變可患厭想、一切
<lb n="0181c04" ed="T"/>世間歸泥洹想。</p><p id="pT15p0181c0407" place="inline">「諸比丘，若以彈指間念此諸
<lb n="0181c05" ed="T"/>想之事，皆為精進行，為奉佛教，不是愚癡食
<lb n="0181c06" ed="T"/>人施也，何況能多行！是故可念行法想。」</p><p id="pT15p0181c0616" place="inline">佛說
<lb n="0181c07" ed="T"/>是已，皆歡喜受。</p></div1>
<lb n="0181c08" ed="T"/><juan n="001" fun="close"><jhead><title>禪行法想經</title></jhead></juan>
</body></text></TEI.2>
